{
  "$schema": "http://json-schema.org/schema#",
  "title": "Validator for misp-galaxies",
  "id": "https://www.github.com/MISP/misp-galaxies/schema.json",
  "type": "object",
  "additionalProperties": false,
  "properties": {
    "description": {
      "type": "string"
    },
    "type": {
      "type": "string"
    },
    "version": {
      "type": "integer"
    },
    "name": {
      "type": "string"
    },
    "uuid": {
      "type": "string"
    },
    "source": {
      "type": "string"
    },
    "values": {
      "type": "array",
      "uniqueItems": true,
      "items": {
        "type": "object",
        "additionalProperties": false,
        "properties": {
          "description": {
            "type": "string"
          },
          "value": {
            "type": "string"
          },
          "meta": {
            "type": "object",
            "additionalProperties": false,
            "properties": {
              "refs": {
                "type": "array",
                "uniqueItems": true,
                "items": {
                  "type": "string"
                }
              },
              "synonyms": {
                "type": "array",
                "uniqueItems": true,
                "items": {
                  "type": "string"
                }
              },
              "derivated_from": {
                "type": "array",
                "uniqueItems": true,
                "items": {
                  "type": "string"
                }
              },
              "status": {
                "type": "string"
              },
              "country": {
                "type": "string"
              },
              "effectiveness": {
                "type": "string"
              },
              "complexity": {
                "type": "string"
              },
              "type": {
                "type": "array",
                "uniqueItems": true,
                "items": {
                  "type": "string"
                }
              },
              "impact": {
                "type": "string"
              },
              "motive": {
                "type": "string"
              },
              "colour": {
                "type": "string"
              },
              "possible_issues": {
                "type": "string"
              }
            }
          }
        },
        "required": [
          "value"
        ]
      }
    },
    "authors": {
      "type": "array",
      "uniqueItems": true,
      "items": {
        "type": "string"
      }
    }
  },
  "required": [
    "description",
    "type",
    "version",
    "name",
    "uuid",
    "values",
    "authors",
    "source"
  ]
}
