{
  "values": [
    {
      "value": "ADB.miner",
      "description": "A new botnet appeared over the weekend, and it's targeting Android devices by scanning for open debug ports so it can infect victims with malware that mines the Monero cryptocurrency.\n\nThe botnet came to life on Saturday, February 3, and is targeting port 5555, which on devices running the Android OS is the port used by the operating system's native Android Debug Bridge (ADB), a debugging interface that grants access to some of the operating system's most sensitive features.\n\nOnly devices running the Android OS have been infected until now, such as smartphones, smart TVs, and TV top boxes, according to security researchers from Qihoo 360's Network Security Research Lab [Netlab] division, the ones who discovered the botnet, which the named ADB.miner.",
      "meta": {
        "refs": [
          "https://www.bleepingcomputer.com/news/security/android-devices-targeted-by-new-monero-mining-botnet/"
        ]
      }
    }
  ],
  "name": "Botnet",
  "type": "botnet",
  "source": "MISP Project",
  "authors": [
    "Various"
  ],
  "description": "botnet galaxy",
  "uuid": "a91732f4-164a-11e8-924a-ffd4097eb03f",
  "version": 1
}
